<?xml version="1.0" encoding="utf-8"?>
<PlayerCharacters xmlns:xsd="http://www.w3.org/2001/XMLSchema" 
    xmlns:xsi="http://www.w3.org/2001/XMLSchema-instance" 
    xsi:noNamespaceSchemaLocation="PlayerCharacters.xsd">
    <PlayerCharacter>
        <PlayerName>Craigp</PlayerName>
        <CharacterName>Nadine</CharacterName>
        <CharacterClass>Amazon</CharacterClass>
        <Bio>amazons rule!!</Bio>
        <Notes>my notes</Notes>
        <StartingLocation>Inn</StartingLocation>
        <StartingSpells></StartingSpells>
        <VictoryRequirements></VictoryRequirements>
        <RecordedActivities>
            <RecordedActivity>
                <PhaseNumber>1</PhaseNumber>
                <PhaseSource>Basic</PhaseSource>
                <PhaseActivity>H</PhaseActivity>
                <Notes></Notes>
            </RecordedActivity>
        </RecordedActivities>
        <Hidden>false</Hidden>
        <Curses></Curses>
        <Bewitchments></Bewitchments>
        <Discoveries></Discoveries>
        <Hirelings></Hirelings>
        <ControlledMonsters></ControlledMonsters>
        <LearnedSpells></LearnedSpells>
        <Gold>10</Gold>
        <Fame>0</Fame>
        <Notoriety>0</Notoriety>
        <ActiveBelongings>
            <Pony>1</Pony>
        </ActiveBelongings>
        <InactiveBelongings></InactiveBelongings>
        <Missions></Missions>
        <Campaigns></Campaigns>
        <PC_History></PC_History>
    </PlayerCharacter>
</PlayerCharacters>
